{
	"$schema": "https://json-schema.org/draft/2020-12/schema",
	"$id": "https://raw.githubusercontent.com/svranic/ladm-schemas/v1.0/schemas/la/core/submission-package.json",
	"title": "LADM Submission Package",
	"description": "A self-contained change package submitted to the cadastral system. Bundles all objects involved in one cadastral transaction: sources (spatial and/or administrative), new spatial features, parties, BAUnits, and RRRs. Voids are declared inside each source's 'voidedObjects'. New objects use client-generated UUIDs — the cadastral system replaces these with persistent identifiers after acceptance.",

	"type": "object",
	"required": ["submissionId", "submittedAt", "sources"],
	"properties": {
		"submissionId": {
			"description": "Unique identifier for this submission, assigned by the submitter's software",
			"type": "string"
		},
		"submittedAt": {
			"description": "ISO 8601 timestamp of submission",
			"type": "string",
			"format": "date-time"
		},
		"submittedBy": {
			"description": "Contact details of the party submitting this package (surveyor, notary, or their software)",
			"$ref": "./datatypes.json#/$defs/Contact"
		},
		"description": {
			"description": "Human-readable description of the transaction (e.g. 'Parcel split 1234/5 into 1234/6 and 1234/7')",
			"type": "string"
		},
		"sources": {
			"description": "Source objects driving this transaction. Must include at least one LA_SpatialSource or LA_AdministrativeSource. Each source declares its own createdObjects and voidedObjects.",
			"type": "array",
			"minItems": 1,
			"items": {
				"$ref": "./datatypes.json#/$defs/SourceRef"
			}
		},
		"spatialFeatures": {
			"description": "JSON-FG FeatureCollection of all spatial features created or modified in this transaction (LA_SpatialUnit, LA_Point, LA_SpatialUnitGroup). coordRefSys is required at collection level.",
			"$ref": "./feature-collection.json"
		},
		"parties": {
			"description": "Party objects created in this transaction (new owners, buyers, etc.). Existing parties are referenced by FeatureRef inside RRRs.",
			"type": "array",
			"items": {
				"$ref": "../administrative/party.json"
			}
		},
		"baUnits": {
			"description": "Basic Administrative Units created in this transaction",
			"type": "array",
			"items": {
				"$ref": "../administrative/ba-unit.json"
			}
		},
		"rrrs": {
			"description": "Rights, Restrictions, and Responsibilities created in this transaction",
			"type": "array",
			"items": {
				"$ref": "./datatypes.json#/$defs/RRRRef"
			}
		}
	}
}
